title;genre;description;img_link
Is That Black Enough for You?!?;History;Tracks the history of Black cinema, focused mainly on the '70s, with archival and new interviews with many of the key players from the era.;History_086.jpg
God of War;History;After 10 years of endless nightmares and servitude to the gods of Olympus, Kratos is assigned with a final task, to kill Ares, the God of War.;History_087.jpg
Outlaw King;History;A true David vs. Goliath story of how the 14th century Scottish 'Outlaw King' Robert the Bruce used cunning and bravery to defeat the much larger and better equipped occupying English army.;History_088.jpg
Empire of the Sun;History;A young English boy struggles to survive under Japanese occupation of China during World War II.;History_089.jpg
The King's Speech;History;The story of King George VI, his impromptu ascension to the throne of the British Empire in 1936, and the speech therapist who helped the unsure monarch overcome his stammer.;History_090.jpg
Spartacus;History;The slave Spartacus survives brutal training as a gladiator and leads a violent revolt against the decadent Roman Republic, as the ambitious Crassus seeks to gain power by crushing the uprising.;History_091.jpg
The Thin Red Line;History;Adaptation of James Jones' autobiographical 1962 novel, focusing on the conflict at Guadalcanal during the second World War.;History_092.jpg
The Great Escape;History;Allied prisoners of war plan for several hundred of their number to escape from a German camp during World War II.;History_093.jpg
Napoleon;History;The film is an original and personal look at Napoleon Bonaparte's origins and his swift, ruthless climb to emperor, viewed through the prism of his addictive and often volatile relationship with his wife and one true love, Josephine.;History_094.jpg
The Courier;History;Businessman Greville Wynne is asked by a Russian source to try to help put an end to the Cuban Missile Crisis.;History_095.jpg
Bridge of Spies;History;During the Cold War, an American lawyer is recruited to defend an arrested Soviet spy in court, and then help the CIA facilitate an exchange of the spy for the Soviet captured American U2 spy plane pilot, Francis Gary Powers.;History_096.jpg
When They See Us;History;Five teens from Harlem become trapped in a nightmare when they're falsely accused of a brutal attack in Central Park. Based on the true story.;History_097.jpg
Kindred;History;A young aspiring writer discovers secrets about her family's past when she finds herself mysteriously being pulled back and forth in time to a 19th century plantation.;History_098.jpg
Britannia;History;In 43 AD, the Roman Army returns to crush the Celtic heart of Britannia.;History_099.jpg
First Man;History;A look at the life of the astronaut, Neil Armstrong, and the legendary space mission that led him to become the first man to walk on the Moon on July 20, 1969.;History_100.jpg
Scream;Horror;25 years after a streak of brutal murders shocked the quiet town of Woodsboro, Calif., a new killer dons the Ghostface mask and begins targeting a group of teenagers to resurrect secrets from the town's deadly past.;Horror_051.jpg
The Last of Us;Horror;Joel and Ellie, a pair connected through the harshness of the world they live in, are forced to endure brutal circumstances and ruthless killers on a trek across post-pandemic America.;Horror_052.jpg
The Witch;Horror;A family in 1630s New England is torn apart by the forces of witchcraft, black magic and possession.;Horror_053.jpg
Run Sweetheart Run;Horror;After what seems to be an innocent date, Cherie now faces a night of terror when her date hunts her down and tries to kill her. She now must run for her life throughout the city and escape his grasp.;Horror_054.jpg
The Haunting of Hill House;Horror;Flashing between past and present, a fractured family confronts haunting memories of their old home and the terrifying events that drove them from it.;Horror_055.jpg
Love, Death & Robots;Horror;A collection of animated short stories that span various genres including science fiction, fantasy, horror and comedy.;Horror_057.jpg
Jeepers Creepers: Reborn;Horror;Forced to travel with her boyfriend, Laine begins to experience premonitions associated with the urban myth of The Creeper. She believes that something supernatural has been summoned - and that she is at the center of it all.;Horror_058.jpg
It;Horror;In the summer of 1989, a group of bullied kids band together to destroy a shape-shifting monster, which disguises itself as a clown and preys on the children of Derry, their small Maine town.;Horror_059.jpg
The Man with the X-Ray Eyes;Horror;A doctor uses special eye drops to give himself x-ray vision, but the new power has disastrous consequences.;Horror_060.jpg
Interview with the Vampire: The Vampire Chronicles;Horror;A vampire tells his epic life story: love, betrayal, loneliness, and hunger.;Horror_061.jpg
Mr. Harrigan's Phone;Horror;When Mr. Harrigan dies, Craig, the teen who befriended and did odd jobs for him, puts his smart phone in his pocket before burial. When the lonely youth sends his dead friend a message, he is shocked to get a return text.;Horror_062.jpg
Scream 6;Horror;In the next installment, the four survivors of the Ghostface killings leave Woodsboro behind and start a fresh chapter in New York City.;Horror_063.jpg
Hereditary;Horror;A grieving family is haunted by tragic and disturbing occurrences.;Horror_064.jpg
Devil in Ohio;Horror;When a psychiatrist shelters a mysterious cult escapee, her world is turned upside down as the girl's arrival threatens to tear her own family apart.;Horror_067.jpg
Men;Horror;A young woman goes on a solo vacation to the English countryside following the death of her ex-husband.;Horror_068.jpg
The Pale Blue Eye;Horror;A world-weary detective is hired to investigate the murder of a West Point cadet. Stymied by the cadets' code of silence, he enlists one of their own to help unravel the case - a young man the world would come to know as Edgar Allan Poe.;Horror_069.jpg
Hocus Pocus;Horror;A teenage boy named Max and his little sister move to Salem, where he struggles to fit in before awakening a trio of diabolical witches that were executed in the 17th century.;Horror_070.jpg
In the Dark;Horror;A blind young woman tries to solve her friend's murder.;Horror_071.jpg
Suspiria;Horror;A darkness swirls at the center of a world-renowned dance company, one that will engulf the artistic director, an ambitious young dancer, and a grieving psychotherapist. Some will succumb to the nightmare. Others will finally wake up.;Horror_072.jpg
Beast;Horror;A father and his two teenage daughters find themselves hunted by a massive rogue lion intent on proving that the Savanna has but one apex predator.;Horror_073.jpg
The Chalk Line;Horror;A couple temporarily adopts a young girl that they found wandering around alone in the high road.;Horror_074.jpg
Mob Psycho 100;Horror;A psychic middle school boy tries to live a normal life and keep his growing powers under control, even though he constantly gets into trouble.;Horror_075.jpg
The Originals;Horror;A family of power-hungry thousand-year-old vampires look to take back the city that they built and dominate all those who have done them wrong.;Horror_076.jpg
Old;Horror;A vacationing family discovers that the secluded beach where they're relaxing for a few hours is somehow causing them to age rapidly, reducing their entire lives into a single day.;Horror_077.jpg
Us;Horror;A family's serene beach vacation turns to chaos when their doppelgängers appear and begin to terrorize them.;Horror_079.jpg
American Horror Stories;Horror;An anthology series of stand-alone episodes delving into horror myths, legends and lore.;Horror_080.jpg
Tusk;Horror;A brash and arrogant podcaster gets more than he bargained for when he travels to Canada to interview a mysterious recluse... who has a rather disturbing fondness for walruses.;Horror_081.jpg
Day Shift;Horror;A hard-working, blue-collar dad just wants to provide a good life for his quick-witted 10-year-old daughter. His mundane San Fernando Valley pool cleaning job is a front for his real source of income: hunting and killing vampires.;Horror_082.jpg
The Kingdom;Horror;Doctors at an ultramodern hospital in Denmark become convinced, by way of weird, inexplicable happenings, that the place is haunted.;Horror_083.jpg
Split;Horror;Three girls are kidnapped by a man with a diagnosed 23 distinct personalities. They must try to escape before the apparent emergence of a frightful new 24th.;Horror_084.jpg
Synchronic;Horror;Two New Orleans paramedics' lives are ripped apart after they encounter a series of horrific deaths linked to a designer drug with bizarre, otherworldly effects.;Horror_085.jpg
Locke & Key;Horror;After their father is murdered under mysterious circumstances, the three Locke siblings and their mother move into their ancestral home, Keyhouse, which they discover is full of magical keys that may be connected to their father's death.;Horror_086.jpg
A Serbian Film;Horror;"An aging porn star agrees to participate in an ""art film"" in order to make a clean break from the business, only to discover that he has been drafted into making a pedophilia and necrophilia themed snuff film.";Horror_087.jpg
Mandrake;Horror;A probation officer, Cathy Madden, is tasked with rehabilitating a notorious killer named 'Bloody' Mary Laidlaw back into society following a two-decade sentence.;Horror_088.jpg
The Conjuring;Horror;Paranormal investigators Ed and Lorraine Warren work to help a family terrorized by a dark presence in their farmhouse.;Horror_089.jpg
Hannibal;Horror;Explores the early relationship between renowned psychiatrist Hannibal Lecter and a young FBI criminal profiler who is haunted by his ability to empathize with serial killers.;Horror_090.jpg
Fresh;Horror;FRESH follows Noa (Daisy Edgar-Jones), who meets the alluring Steve (Sebastian Stan) at a grocery store and - given her frustration with dating apps - takes a chance and gives him her number.;Horror_091.jpg
Splice;Horror;Genetic engineers Clive Nicoli and Elsa Kast hope to achieve fame by successfully splicing together the DNA of different animals to create new hybrid animals for medical use.;Horror_092.jpg
Grimm;Horror;A homicide detective discovers he is a descendant of hunters who fight supernatural forces.;Horror_093.jpg
From Dusk Till Dawn;Horror;Two criminals and their hostages unknowingly seek temporary refuge in a truck stop populated by vampires, with chaotic results.;Horror_094.jpg
M3gan;Horror;A robotics engineer at a toy company builds a life-like doll that begins to take on a life of its own.;Horror_095.jpg
Evil;Horror;;Horror_096.jpg
Halloween;Horror;Fifteen years after murdering his sister on Halloween night 1963, Michael Myers escapes from a mental hospital and returns to the small town of Haddonfield, Illinois to kill again.;Horror_097.jpg
Scream;Horror;A year after the murder of her mother, a teenage girl is terrorized by a new killer, who targets the girl and her friends by using horror films as part of a deadly game.;Horror_098.jpg
Phone Bhoot;Horror;A ghost reaches out to two bumbling ghostbusters for a business idea. However, their plans go downhill as the eerie ghost reveals her plan.;Horror_099.jpg
The Lost Boys;Horror;After moving to a new town, two brothers discover that the area is a haven for vampires.;Horror_100.jpg
9 Songs;Music;In London, intense sexual encounters take place between an American college student, named Lisa, and an English scientist, named Matt, between attending rock concerts.;Music_051.jpg
Bernstein;Music;The complex love of Leonard and Felicia, from the time they met in 1946 at a party and continuing through two engagements, a 25 year marriage, and three children.;Music_052.jpg
The Dirt;Music;Based on the bestselling autobiography from Mötley Crüe, the film is an unflinching tale of success and excess as four misfits rise from the streets of Hollywood to the heights of international fame.;Music_053.jpg
The Piano Teacher;Music;A young man romantically pursues his masochistic piano teacher.;Music_054.jpg
Sound of Metal;Music;A heavy-metal drummer's life is thrown into freefall when he begins to lose his hearing.;Music_055.jpg
High School Musical;Music;A popular high-school athlete and an academically-gifted girl get roles in the school musical and develop a friendship that threatens East High's social order.;Music_057.jpg
Daisy Jones & The Six;Music;Following the rise of Daisy Jones and The Six' rock band through the '70s LA music scene on their quest for worldwide icon status.;Music_058.jpg
Straight Outta Compton;Music;The rap group NWA emerges from the mean streets of Compton in Los Angeles, California, in the mid-1980s and revolutionizes Hip Hop culture with their music and tales about life in the hood.;Music_059.jpg
The Piano;Music;In the mid-19th century a mute woman is sent to New Zealand along with her young daughter and prized piano for an arranged marriage to a farmer, but is soon lusted after by a farm worker.;Music_060.jpg
Bruce Mercury and the Band of Pirates: XXX Lust;Music;;Music_061.jpg
Sister Act;Music;When a nightclub singer is forced to take refuge from the mob in a convent, she ends up turning the convent choir into a soulful chorus complete with a Motown repertoire, until the sudden celebrity of the choir jeopardizes her identity.;Music_062.jpg
A Country Christmas Harmony;Music;Follows Luke and Chrissy, a former country music duo and ex-sweethearts who run into each other years later after Chrissy disappeared on Luke, but now they realize they can only survive the holidays with the other one's help.;Music_063.jpg
Rio;Music;When Blu, a domesticated macaw from small-town Minnesota, meets the fiercely independent Jewel, he takes off on an adventure to Rio de Janeiro with the bird of his dreams.;Music_064.jpg
Dave;Music;A neurotic mid-20s suburbanite's convinced he's destined to be one of the greatest rappers of all time. Now he's got to prove it to everyone else.;Music_065.jpg
Sister Act 2: Back in the Habit;Music;Showgirl Deloris Van Cartier returns as Sister Mary Clarence to teach music to a group of Catholic students whose run-down school is slated for closure.;Music_066.jpg
The Masked Singer;Music;A singing competition guessing game based on Korean format King of Mask Singer. 12 celebrity performers wear costumes to conceal identities. One singer is eliminated each week and unmasked. Small hints are given for the viewer guess along.;Music_068.jpg
Mood;Music;Follow irrepressible Sasha, a 25-year-old wannabe singer and rapper, as she navigates the alluring world of social media and the fine line between liberation and exploitation, a story told through her original songs.;Music_069.jpg
Victorious;Music;Aspiring singer Tori Vega navigates life while attending a performing arts high school called Hollywood Arts.;Music_070.jpg
Bill & Ted Face the Music;Music;Once told they'd save the universe during a time-traveling adventure, 2 would-be rockers from San Dimas, California find themselves as middle-aged dads still trying to crank out a hit song and fulfill their destiny.;Music_071.jpg
High Fidelity;Music;Rob, a record store owner and compulsive list maker, recounts his top five breakups, including the one in progress.;Music_072.jpg
Studio 666;Music;Legendary rock band Foo Fighters move into an Encino mansion steeped in grisly rock and roll history to record their much anticipated 10th album.;Music_073.jpg
That Thing You Do!;Music;A local Pennsylvania band scores a one-hit wonder in 1964 and rides the star-making machinery as long as they can, with lots of help from their manager.;Music_074.jpg
Step Up;Music;Tyler Gage receives the opportunity of a lifetime after vandalizing a performing arts school, gaining him the chance to earn a scholarship and dance with an up and coming dancer, Nora.;Music_075.jpg
Alvin and the Chipmunks;Music;Three musical chipmunks are discovered by an aspiring songwriter who wants to use their amazing singing abilities to become famous.;Music_076.jpg
I Used to Be Famous;Music;Follows Vince, a desperate former popstar who dreams of making a comeback. An impromptu jam session with autistic young drummer Stevie sparks an unexpected friendship between the two misunderstood musicians.;Music_077.jpg
Fisherman's Friends: One and All;Music;Following the success of their first album, the Fisherman's Friends struggle to adjust to their new-found fame and work towards a second album.;Music_078.jpg
Belle: The Dragon and the Freckled Princess;Music;"Suzu is a shy high school student living in a rural village. For years, she has only been a shadow of herself. But when she enters ""U"", a massive virtual world, she escapes into her online persona as Belle, a globally-beloved singer.";Music_079.jpg
The Wedding Singer;Music;Robbie, a singer, and Julia, a waitress, are both engaged, but to the wrong people. Fortune intervenes to help them discover each other.;Music_080.jpg
Meet the Robinsons;Music;Lewis is a brilliant inventor who meets mysterious stranger named Wilbur Robinson, whisking Lewis away in a time machine and together they team up to track down Bowler Hat Guy in a showdown that ends with an unexpected twist of fate.;Music_081.jpg
Empire Records;Music;Twenty-four hours in the lives of the young employees at Empire Records when they all grow up and become young adults thanks to each other and the manager. They all face the store joining a chain store with strict rules.;Music_082.jpg
Tarzan;Music;A man raised by gorillas must decide where he really belongs when he discovers he is a human.;Music_083.jpg
Hannah Montana;Music;Adventures of a teenage pop star who keeps her identity secret from even her closest friends by using a disguise on-stage.;Music_084.jpg
Walk the Line;Music;A chronicle of country music legend Johnny Cash's life, from his early days on an Arkansas cotton farm to his rise to fame with Sun Records in Memphis, where he recorded alongside Elvis Presley, Jerry Lee Lewis, and Carl Perkins.;Music_085.jpg
Dancing with the Stars;Music;"U.S. reality show based on the British series ""Strictly Come Dancing,"" where celebrities partner up with professional dancers and compete against each other in weekly elimination rounds to determine a winner.";Music_086.jpg
Dick Tracy;Music;The comic strip detective finds his life vastly complicated when Breathless Mahoney makes advances towards him while he is trying to battle Big Boy Caprice's united mob.;Music_087.jpg
Pitch Perfect 3;Music;Following their win at the world championship, the now separated Bellas reunite for one last singing competition at an overseas USO tour, but face a group who uses both instruments and voices.;Music_088.jpg
Across the Universe;Music;The music of The Beatles and the Vietnam War form the backdrop for the romance between an upper-class American girl and a poor Liverpudlian artist.;Music_089.jpg
Save the Last Dance;Music;A white midwestern girl moves to Chicago, where her new boyfriend is a black teen from the South Side with a rough, semi-criminal past.;Music_090.jpg
Girl Meets World;Music;More than a decade after Boy Meets World (1993), Cory and Topanga Matthews are married and have two children. Their daughter, Riley, faces life lessons through her family, friends, and school--where her father is her history teacher--as her parents did when they were younger.;Music_091.jpg
The Doors;Music;The story of the famous and influential 1960s rock band The Doors and its lead singer and composer, Jim Morrison, from his days as a UCLA film student in Los Angeles, to his untimely death in Paris, France at age 27 in 1971.;Music_092.jpg
Rheingold;Music;Capturing the life of German hip-hop rapper, entrepreneur, and ex-convict Giwar Hajabi.;Music_093.jpg
Bill & Ted's Excellent Adventure;Music;Two rock-'n-rolling teens, on the verge of failing their class, are approached by a time machine that helps them make the ultimate history presentation.;Music_094.jpg
Flashdance;Music;A Pittsburgh woman with two jobs as a welder and an exotic dancer wants to get into ballet school.;Music_095.jpg
Billy Elliot;Music;A talented young boy becomes torn between his unexpected love of dance and the disintegration of his family.;Music_096.jpg
Empire;Music;A hip-hop mogul must choose a successor among his three sons who are battling for control over his multi-million dollar company, while his ex-wife schemes to reclaim what is hers.;Music_097.jpg
Everybody Hates Chris;Music;A young African-American teen attempts to survive with his dysfunctional family and his all-white school in the 1980s.;Music_098.jpg
Black Snake Moan;Music;A God-fearing bluesman takes to a wild young woman who, as a victim of childhood sexual abuse, looks everywhere for love, never quite finding it.;Music_099.jpg
Top Secret!;Music;An American rock and roll singer becomes involved in a Resistance plot to rescue a scientist imprisoned in East Germany.;Music_100.jpg
Aladdin;Musical;A kindhearted street urchin and a power-hungry Grand Vizier vie for a magic lamp that has the power to make their deepest wishes come true.;Musical_051.jpg
Corpse Bride;Musical;When a shy groom practices his wedding vows in the inadvertent presence of a deceased young woman, she rises from the grave assuming he has married her.;Musical_052.jpg
Scrooge: A Christmas Carol;Musical;A supernatural, time-travelling, musical adaptation of Charles Dickens's cult Christmas story;Musical_053.jpg
Mary Poppins;Musical;In turn of the century London, a magical nanny employs music and adventure to help two neglected children become closer to their father.;Musical_054.jpg
Snow White;Musical;Live-action adaptation of the 1937 Disney animated film 'Snow White and the Seven Dwarfs'.;Musical_055.jpg
Annie;Musical;A spunky young orphan is taken in by a rich eccentric, much to the chagrin of the cantankerous woman who runs the orphanage.;Musical_056.jpg
The Cuphead Show!;Musical;Follow the misadventures of the impulsive Cuphead and his cautious but persuadable brother Mugman in this animated series based on the hit video game.;Musical_057.jpg
Beauty and the Beast;Musical;A prince cursed to spend his days as a hideous monster sets out to regain his humanity by earning a young woman's love.;Musical_058.jpg
Into the Woods;Musical;A witch tasks a childless baker and his wife with procuring magical items from classic fairy tales to reverse the curse put on their family tree.;Musical_059.jpg
Annie;Musical;A foster kid, who lives with her mean foster mom, sees her life change when business tycoon and New York City mayoral candidate Will Stacks makes a thinly-veiled campaign move and takes her in.;Musical_060.jpg
The Princess and the Frog;Musical;A waitress, desperate to fulfill her dreams as a restaurant owner, is set on a journey to turn a frog prince back into a human being, but she has to face the same problem after she kisses him.;Musical_061.jpg
Chicago;Musical;Two death-row murderesses develop a fierce rivalry while competing for publicity, celebrity, and a sleazy lawyer's attention.;Musical_062.jpg
Monster High;Musical;Follows a half human and half werewolf, as she finally finds a place where she fits, but, when a devious plan to destroy Monster High threatens to reveal her identity, she must learn to embrace her true monster heart and save the day.;Musical_063.jpg
Rocketman;Musical;A musical fantasy about the fantastical human story of Elton John's breakthrough years.;Musical_064.jpg
Earth Girls Are Easy;Musical;A Southern California girl befriends three furry aliens after their spaceship lands in her swimming pool.;Musical_065.jpg
Cinderella;Musical;A modern movie musical with a bold take on the classic fairy tale. Our ambitious heroine has big dreams and with the help of her fab Godmother, she perseveres to make them come true.;Musical_067.jpg
Anastasia;Musical;The last surviving child of the Russian Royal Family joins two con men to reunite with her grandmother, the Dowager Empress, while the undead Rasputin seeks her death.;Musical_068.jpg
Wicked;Musical;The story of how a green-skinned woman framed by the Wizard of Oz becomes the Wicked Witch of the West. The first of a two-part feature film adaptation of the Broadway musical.;Musical_069.jpg
A Goofy Movie;Musical;When Max makes a preposterous promise to a girl he has a crush on, his chances to fulfilling it seem hopeless when he is dragged onto a cross-country trip with his embarrassing father, Goofy.;Musical_070.jpg
Frozen 2;Musical;Anna, Elsa, Kristoff, Olaf and Sven leave Arendelle to travel to an ancient, autumn-bound forest of an enchanted land. They set out to find the origin of Elsa's powers in order to save their kingdom.;Musical_071.jpg
tick, tick... BOOM!;Musical;On the cusp of his 30th birthday, a promising young theater composer navigates love, friendship and the pressures of life as an artist in New York City.;Musical_072.jpg
High School Musical;Musical;A popular high-school athlete and an academically-gifted girl get roles in the school musical and develop a friendship that threatens East High's social order.;Musical_073.jpg
Sweeney Todd: The Demon Barber of Fleet Street;Musical;The legendary tale of a barber who returns from wrongful imprisonment to 1840s London, bent on revenge for the rape and death of his wife, and resumes his trade while forming a sinister partnership with his fellow tenant, Mrs. Lovett.;Musical_075.jpg
Descendants;Musical;The teenage son of the king and queen of Auradon offers the trouble-making children of villains a chance to attend prep school in the kingdom.;Musical_076.jpg
Rudolph the Red-Nosed Reindeer;Musical;Young reindeer Rudolph lives at the North Pole. His father is one of Santa's reindeer and it is expected that Rudolph will eventually be one too. However, he has a feature which is a setback and causes him to be ostracized: his red nose.;Musical_077.jpg
