title;genre;description;img_link
Rick and Morty;Sci-Fi;An animated series that follows the exploits of a super scientist and his not-so-bright grandson.;Sci-Fi_016.jpg
Elemental;Sci-Fi;Follows Ember and Wade, in a city where fire-, water-, land- and air-residents live together.;Sci-Fi_017.jpg
Everything Everywhere All at Once;Sci-Fi;An aging Chinese immigrant is swept up in an insane adventure, in which she alone can save the world by exploring other universes connecting with the lives she could have led.;Sci-Fi_018.jpg
Thor: Love and Thunder;Sci-Fi;Thor enlists the help of Valkyrie, Korg and ex-girlfriend Jane Foster to fight Gorr the God Butcher, who intends to make the gods extinct.;Sci-Fi_019.jpg
Severance;Sci-Fi;Mark leads a team of office workers whose memories have been surgically divided between their work and personal lives. When a mysterious colleague appears outside of work, it begins a journey to discover the truth about their jobs.;Sci-Fi_020.jpg
Black Mirror;Sci-Fi;An anthology series exploring a twisted, high-tech multiverse where humanity's greatest innovations and darkest instincts collide.;Sci-Fi_021.jpg
The Sandman;Sci-Fi;Upon escaping after decades of imprisonment by a mortal wizard, Dream, the personification of dreams, sets about to reclaim his lost equipment.;Sci-Fi_022.jpg
Strange World;Sci-Fi;The legendary Clades are a family of explorers whose differences threaten to topple their latest and most crucial mission.;Sci-Fi_023.jpg
Westworld;Sci-Fi;At the intersection of the near future and the reimagined past, waits a world in which every human appetite can be indulged without consequence.;Sci-Fi_024.jpg
The Mandalorian;Sci-Fi;The travels of a lone bounty hunter in the outer reaches of the galaxy, far from the authority of the New Republic.;Sci-Fi_025.jpg
Yashoda;Sci-Fi;A pregnant woman named Yashodha is advised to follow a few guidelines about her physical and mental well being and safety. However, a set of events occur that make Yashoda live on the edge, risking her well being.;Sci-Fi_026.jpg
She-Hulk: Attorney at Law;Sci-Fi;Jennifer Walters navigates the complicated life of a single, 30-something attorney who also happens to be a green 6-foot-7-inch superpowered Hulk.;Sci-Fi_027.jpg
Avatar;Sci-Fi;A paraplegic Marine dispatched to the moon Pandora on a unique mission becomes torn between following his orders and protecting the world he feels is his home.;Sci-Fi_028.jpg
Inside Job;Sci-Fi;For employees of the Deep State, conspiracies aren't just theories, they're fact. And keeping them a secret is a full-time job.;Sci-Fi_029.jpg
Star Wars: Tales of the Jedi;Sci-Fi;It showcases animated shorts that feature Jedi from the prequel era.;Sci-Fi_030.jpg
The X Files;Sci-Fi;Two F.B.I. Agents, Fox Mulder the believer and Dana Scully the skeptic, investigate the strange and unexplained, while hidden forces work to impede their efforts.;Sci-Fi_031.jpg
Avenue 5;Sci-Fi;The troubled crew of Avenue 5, a space cruise ship filled with spoiled, rich, snotty space tourists, must try and keep everyone calm after their ship gets thrown off course into space and ends up needing three years to return to Earth.;Sci-Fi_032.jpg
Spider-Man: No Way Home;Sci-Fi;With Spider-Man's identity now revealed, Peter asks Doctor Strange for help. When a spell goes wrong, dangerous foes from other worlds start to appear, forcing Peter to discover what it truly means to be Spider-Man.;Sci-Fi_033.jpg
Interstellar;Sci-Fi;A team of explorers travel through a wormhole in space in an attempt to ensure humanity's survival.;Sci-Fi_034.jpg
Lost;Sci-Fi;The survivors of a plane crash are forced to work together in order to survive on a seemingly deserted tropical island.;Sci-Fi_035.jpg
Dune;Sci-Fi;A noble family becomes embroiled in a war for control over the galaxy's most valuable asset while its heir becomes troubled by visions of a dark future.;Sci-Fi_036.jpg
Rogue One;Sci-Fi;In a time of conflict, a group of unlikely heroes band together on a mission to steal the plans to the Death Star, the Empire's ultimate weapon of destruction.;Sci-Fi_037.jpg
Avengers: Endgame;Sci-Fi;After the devastating events of Avengers: Infinity War (2018), the universe is in ruins. With the help of remaining allies, the Avengers assemble once more in order to reverse Thanos' actions and restore balance to the universe.;Sci-Fi_038.jpg
The Flash;Sci-Fi;After being struck by lightning, Barry Allen wakes up from his coma to discover he's been given the power of super speed, becoming the Flash, and fighting crime in Central City.;Sci-Fi_039.jpg
See;Sci-Fi;Far in a dystopian future, the human race has lost the sense of sight, and society has had to find new ways to interact, build, hunt, and to survive. All of that is challenged when a set of twins are born with sight.;Sci-Fi_040.jpg
La Brea;Sci-Fi;A massive sinkhole mysteriously opens up in Los Angeles, separating part of a family in an unexplainable primeval world, alongside a desperate group of strangers.;Sci-Fi_041.jpg
Morbius;Sci-Fi;Biochemist Michael Morbius tries to cure himself of a rare blood disease, but he inadvertently infects himself with a form of vampirism instead.;Sci-Fi_042.jpg
Ant-Man and the Wasp: Quantumania;Sci-Fi;Scott Lang and Hope Van Dyne, along with Hank Pym and Janet Van Dyne, explore the Quantum Realm, where they interact with strange creatures and embark on an adventure that goes beyond the limits of what they thought was possible.;Sci-Fi_043.jpg
The Orville;Sci-Fi;Set 400 years in the future, finds the crew of the U.S.S. Orville continuing their mission of exploration, as they navigate both the mysteries of the universe and the complexities of their own interpersonal relationships.;Sci-Fi_044.jpg
Quantum Leap;Sci-Fi;Set 30 years after Dr. Sam Beckett stepped into the Quantum Leap accelerator and vanished, follows a new team that must restart the project hoping to understand the mysteries behind the machine and its creator.;Sci-Fi_045.jpg
Doctor Strange in the Multiverse of Madness;Sci-Fi;;Sci-Fi_046.jpg
Fear the Walking Dead;Sci-Fi;A Walking Dead spinoff set in Los Angeles, California. Follows two families who must band together to survive the undead apocalypse.;Sci-Fi_047.jpg
Jurassic World: Dominion;Sci-Fi;Four years after the destruction of Isla Nublar, Biosyn operatives attempt to track down Maisie Lockwood, while Dr Ellie Sattler investigates a genetically engineered swarm of giant insects.;Sci-Fi_048.jpg
Inception;Sci-Fi;A thief who steals corporate secrets through the use of dream-sharing technology is given the inverse task of planting an idea into the mind of a C.E.O., but his tragic past may doom the project and his team to disaster.;Sci-Fi_049.jpg
From;Sci-Fi;Unravel the mystery of a city in middle U.S.A. that imprisons everyone who enters. As the residents struggle to maintain a sense of normalcy and seek a way out, they must also survive the threats of the surrounding forest.;Sci-Fi_050.jpg
Star Wars: Tales of the Jedi;Short;It showcases animated shorts that feature Jedi from the prequel era.;Short_01.jpg
Abbott Elementary;Short;Follows a group of teachers brought together in one of the worst public schools in the country, simply because they love teaching.;Short_02.jpg
Zootopia+;Short;The adventures of the creatures of the most incredible metropolis: Zootopia.;Short_03.jpg
Hotel Desire;Short;A young single mother drops her son of at the bus stop to visit his dad in Paris. After being late for work, she almost gets fired. At the end of her duties she gets into a tricky situation which she handles, with the advice her colleague gave her.;Short_04.jpg
Love, Death & Robots;Short;A collection of animated short stories that span various genres including science fiction, fantasy, horror and comedy.;Short_05.jpg
Lopez vs. Lopez;Short;A working-class family comedy about dysfunction, reconnection, and all the pain and joy in between.;Short_06.jpg
Family Reunion;Short;When the McKellan family moves from Seattle to Georgia to be closer to extended family, the transition is like being a catfish out of water.;Short_07.jpg
Transformers: Earthspark;Short;A new species of Transformers must find their place and purpose among Autobots, Decepticons, and the human family who adopts them.;Short_08.jpg
Black Panther: Origins;Short;The untold story of how T'Challa, the King of Wakanda, rose to power in the isolated, technologically advanced African nation of Wakanda.;Short_09.jpg
Over the Garden Wall;Short;Two brothers find themselves lost in a mysterious land and try to find their way home.;Short_010.jpg
The Cuphead Show!;Short;Follow the misadventures of the impulsive Cuphead and his cautious but persuadable brother Mugman in this animated series based on the hit video game.;Short_011.jpg
Kenobi: A Star Wars Fan Film;Short;After years in hiding, Obi-Wan Kenobi struggles to reconnect with the Force in order to protect Luke Skywalker from Imperial forces.;Short_012.jpg
Bob Hearts Abishola;Short;An American guy falls in love with his Nigerian nurse.;Short_013.jpg
Boss Bitch Fight Challenge;Short;At home and bored during the pandemic lockdown, Zoë Bell picks a fight with her Boss Bitch friends. Glorious mayhem ensues.;Short_014.jpg
Bruce Mercury and the Band of Pirates: XXX Lust;Short;;Short_015.jpg
Home Movie: The Princess Bride;Short;Serialized remake of 'The Princess Bride' told in short chapters featuring celebrities at home during quarantine.;Short_016.jpg
I Am Groot;Short;A series of shorts featuring the seedling Groot along with several new and unusual characters.;Short_017.jpg
Laura Hasn't Slept;Short;Desperate to rid herself of a recurring nightmare, a young woman seeks the help of her therapist.;Short_018.jpg
State of Alabama vs. Brittany Smith;Short;Tells the harrowing story of a woman trying to use Alabama's Stand Your Ground law after killing a man she says brutally attacked her.;Short_019.jpg
Phineas and Ferb;Short;Phineas and Ferb invent, scheme, and stay one step ahead of their bratty sister. Meanwhile, their pet platypus plots against evil Dr. Doofenshmirtz.;Short_020.jpg
The Amazing World of Gumball;Short;The life of a twelve-year-old boy who happens to be a blue cat as he lives with his family and other strange creatures.;Short_021.jpg
Father of the Bride Part 3 (ish);Short;Twenty-five years after the second movie's release, the Banks family gathers for a Zoom call and a very special wedding-related announcement.;Short_022.jpg
Terrifier;Short;After witnessing a brutal murder on Halloween night, a young woman becomes the next target of a maniacal entity.;Short_023.jpg
Amphibia;Short;Ordinary Anne Boonchuy, 13, finds a music box that sends her to Amphibia, a world full of frogs, toads, and giant insects. With help from Sprig, she must adjust to life in Amphibia and discover the first true friendship in her life.;Short_024.jpg
Gabby's Dollhouse;Short;This colorful series leads preschoolers room to room through a fantastical dollhouse of delightful mini-worlds and irresistible kitty characters.;Short_025.jpg
Most Dangerous Game;Short;Desperate to take care of his pregnant wife before a terminal illness can take his life, Dodge Tynes accepts an offer to participate in a deadly game where he soon discovers that he's not the hunter - but the prey.;Short_026.jpg
By the Lake;Short;Angela goes for a walk in the nude down by the lake.;Short_028.jpg
Teen Titans Go!;Short;Superhero roommates Robin, Cyborg, Starfire, Raven and Beast Boy love saving the day, but what happens when they're done fighting crime?;Short_029.jpg
Oats Studios;Short;It is a series of experimental short films that envision post-apocalyptic worlds and nightmarish scenarios.;Short_030.jpg
Weird: The Al Yankovic Story;Short;A fictional biographical film that parodies other films based on musicians. Yankovic is played by Aaron Paul, while Yankovic himself plays a music producer.;Short_032.jpg
The Loud House;Short;Lincoln Loud is an eleven-year-old boy who lives with ten sisters. With the help of his right-hand man Clyde, Lincoln finds new ways to survive in such a large family every day.;Short_033.jpg
Man vs. Bee;Short;A man finds himself at war with a bee while housesitting a luxurious mansion. Who will win, and what irreparable damage will be done in the process?;Short_034.jpg
The Sandman;Short;When The Sandman is pulled from his realm and imprisoned on Earth, he languishes for decades before finally escaping.;Short_035.jpg
Tom and Jerry;Short;House cat (Tom) and a mouse (Jerry). The plots of each short usually center on Tom and Jerry's numerous attempts to have the best of each other and the mayhem and destruction that follows.;Short_036.jpg
A Charlie Brown Thanksgiving;Short;Peppermint Patty invites herself and her friends over to Charlie Brown's for Thanksgiving, and with Linus, Snoopy, and Woodstock, he attempts to throw together a Thanksgiving dinner.;Short_037.jpg
Smiling Friends;Short;Follows employees of a small company dedicated to bringing happiness to a bizarre yet colorful world.;Short_038.jpg
Thomas & Friends: Big World! Big Adventures!;Short;This series follows the adventures of Thomas the Tank Engine and all of his engine friends on the Island of Sodor.;Short_039.jpg
Star vs. the Forces of Evil;Short;Star Butterfly arrives on Earth to live with the Diazes, a Mexican-American family. She continues to battle villains throughout the universe and high school, mainly to protect her extremely powerful wand, an object that still confuses her.;Short_040.jpg
Judy Justice;Short;Judge Judy Sheindlin presides over a new array of cases, litigants and judgments.;Short_041.jpg
Zen - Grogu and Dust Bunnies;Short;"""Zen - Grogu and Dust Bunnies"" is a hand drawn animated short by Studio Ghibli.";Short_042.jpg
As Above, So Below: The Underworld of 'John Wick';Short;A close look at the assassin's lifestyle in the film.;Short_044.jpg
Craig of the Creek;Short;Craig of the Creek follows a young boy, Craig, and his two friends, Kelsey and JP, as they go on adventures within a world of untamed, kid-dominated wilderness in the creek.;Short_045.jpg
Threat Level Midnight: The Movie;Short;;Short_046.jpg
The Boys Presents: Diabolical;Short;A collection of animated short stories that takes place inside The Boys universe.;Short_047.jpg
Frosty the Snowman;Short;A living snowman and a little girl struggle to elude a greedy magician who is after the snowman's magic hat.;Short_048.jpg
Superman/Shazam! The Return of Black Adam;Short;Superman finds a foe who may be too powerful even for him to defeat in the murderous Black Adam. Fortunately, Black Adam's real target is the Earth's Mightiest Mortal--Captain Marvel.;Short_049.jpg
The 9th Circle;Short;A woman is abducted by a sinister stranger on Halloween night for a fate worse than death.;Short_050.jpg
Ted Lasso;Sport;American college football coach Ted Lasso heads to London to manage AFC Richmond, a struggling English Premier League football team.;Sport_01.jpg
One Tree Hill;Sport;Half-brothers Lucas and Nathan Scott trade between kinship and rivalry both on the basketball court and in the hearts of their friends in the small, but not so quiet town of Tree Hill, North Carolina.;Sport_02.jpg
Lamborghini;Sport;The life story of Ferruccio Lamborghini, the founder of Lamborghini.;Sport_03.jpg
Chariots of Fire;Sport;Two British track athletes, one a determined Jew and the other a devout Christian, are driven to win in the 1924 Olympics as they wrestle with issues of pride and conscience.;Sport_04.jpg
Cobra Kai;Sport;Decades after their 1984 All Valley Karate Tournament bout, a middle-aged Daniel LaRusso and Johnny Lawrence find themselves martial-arts rivals again.;Sport_05.jpg
FIFA Uncovered;Sport;From power struggles to global politics, an exploration of FIFA reveals the organization's checkered history and what it takes to host a World Cup.;Sport_06.jpg
The Mighty Ducks: Game Changers;Sport;After failing to make the cut to join the now powerhouse Mighty Ducks junior hockey team, 12-year-old Evan's mother encourages him to form a new team of underdogs with help from Gordon Bombay, the Ducks' original coach.;Sport_07.jpg
Friday Night Lights;Sport;A drama that follows the lives of the Dillon Panthers, one of the nation's best high school football teams, and their head coach Eric Taylor.;Sport_08.jpg
Creed III;Sport;Adonis has been thriving in both his career and family life, but when a childhood friend and former boxing prodigy resurfaces, the face-off is more than just a fight.;Sport_09.jpg
Le Mans '66;Sport;American car designer Carroll Shelby and driver Ken Miles battle corporate interference and the laws of physics to build a revolutionary race car for Ford in order to defeat Ferrari at the 24 Hours of Le Mans in 1966.;Sport_010.jpg
All American;Sport;When a star high school football player from South Central is recruited to play for Beverly Hills High School, two separate worlds collide.;Sport_011.jpg
A League of Their Own;Sport;Comedy series about the WWII All-American professional women's baseball league.;Sport_012.jpg
Hustle;Sport;A basketball scout discovers a phenomenal street ball player while in Spain and sees the prospect as his opportunity to get back into the NBA.;Sport_013.jpg
Welcome to Wrexham;Sport;Docuseries chronicling the purchase and stewardship of Wrexham AFC, one of professional football's oldest clubs, by two Hollywood actors, Ryan Reynolds and Rob McElhenney.;Sport_014.jpg
The Soccer Football Movie;Sport;Four young soccer superfans team up to help their idols regain their abilities after a scheming evil scientist steals their talent.;Sport_015.jpg
80 for Brady;Sport;A group of friends made it their life-long mission to go to the Super Bowl and meet NFL superstar Tom Brady.;Sport_016.jpg
Cars;Sport;On the way to the biggest race of his life, a hotshot rookie race car gets stranded in a rundown town, and learns that winning isn't everything in life.;Sport_017.jpg
Rocky;Sport;A small-time Philadelphia boxer gets a supremely rare chance to fight the world heavyweight champion in a bout in which he strives to go the distance for his self-respect.;Sport_018.jpg
Moneyball;Sport;Oakland A's general manager Billy Beane's successful attempt to assemble a baseball team on a lean budget by employing computer-generated analysis to acquire new players.;Sport_020.jpg
Warrior;Sport;The youngest son of an alcoholic former boxer returns home, where he's trained by his father for competition in a mixed martial arts tournament - a path that puts the fighter on a collision course with his estranged, older brother.;Sport_021.jpg
Dodgeball: A True Underdog Story;Sport;A group of misfits enter a Las Vegas dodgeball tournament in order to save their cherished local gym from the onslaught of a corporate health fitness chain.;Sport_022.jpg
The Replacements;Sport;During a pro football strike, the owners hire substitute players.;Sport_023.jpg
The Waterboy;Sport;A waterboy for a college football team discovers he has a unique tackling ability and becomes a member of the team.;Sport_024.jpg
Molly's Game;Sport;The true story of Molly Bloom, an Olympic-class skier who ran the world's most exclusive high-stakes poker game and became an FBI target.;Sport_025.jpg
Blue Lock;Sport;;Sport_026.jpg
Creed;Sport;The former World Heavyweight Champion Rocky Balboa serves as a trainer and mentor to Adonis Johnson, the son of his late friend and former rival Apollo Creed.;Sport_027.jpg
The Karate Kid;Sport;A martial arts master agrees to teach karate to a bullied teenager.;Sport_028.jpg
The Longest Yard;Sport;Prison inmates form a football team to challenge the prison guards.;Sport_030.jpg
Remember the Titans;Sport;The true story of a newly appointed African-American coach and his high school team on their first season as a racially integrated unit.;Sport_031.jpg
Big Shot;Sport;A temperamental college basketball coach who gets fired from his job and must take a teaching and coaching job at an elite all-girls private high school.;Sport_032.jpg
Fighting with My Family;Sport;A former wrestler and his family make a living performing at small venues around the country while his kids dream of joining World Wrestling Entertainment.;Sport_033.jpg
A League of Their Own;Sport;Two sisters join the first female professional baseball league and struggle to help it succeed amid their own growing rivalry.;Sport_034.jpg
King Richard;Sport;A look at how tennis superstars Venus and Serena Williams became who they are after the coaching from their father Richard Williams.;Sport_036.jpg
All American: Homecoming;Sport;Follows a young tennis hopeful from Beverly Hills and an elite baseball player from Chicago as they contend with the high stakes of college sports.;Sport_037.jpg
Rush;Sport;The merciless 1970s rivalry between Formula One rivals James Hunt and Niki Lauda.;Sport_038.jpg
17 Again;Sport;Mike O'Donnell is ungrateful for how his life turned out. He gets a chance to rewrite his life when he tried to save a janitor near a bridge and jumped after him into a time vortex.;Sport_039.jpg
The Grand Tour;Sport;Follow Jeremy, Richard and James, as they embark on an adventure across the globe, driving new and exciting automobiles from manufacturers all over the world.;Sport_040.jpg
Happy Gilmore;Sport;A rejected hockey player puts his skills to the golf course to save his grandmother's house.;Sport_041.jpg
The Blind Side;Sport;The story of Michael Oher, a homeless and traumatized boy who became an All-American football player and first-round NFL draft pick with the help of a caring woman and her family.;Sport_042.jpg
No Limit;Sport;Roxana Aubrey decides to drop her studies and escape her life in Paris for a free diving course in the south of France. She is quickly pulled into a life that reaches new depths brought by the weight of an ocean's descent.;Sport_043.jpg
Winning Time: The Rise of the Lakers Dynasty;Sport;The professional and personal lives of the 1980s Los Angeles Lakers, one of sports' most revered and dominant dynasties - a team that defined an era, both on and off the court.;Sport_044.jpg
The Sandlot Kids;Sport;In the summer of 1962, a new kid in town is taken under the wing of a young baseball prodigy and his rowdy team, resulting in many adventures.;Sport_045.jpg
Creed II;Sport;Under the tutelage of Rocky Balboa, newly crowned heavyweight champion Adonis Creed faces off against Viktor Drago, the son of Ivan Drago.;Sport_046.jpg
The League;Sport;An ensemble comedy that follows a group of old friends in a fantasy football league who care deeply about one another -- so deeply that they use every opportunity to make each other's lives miserable.;Sport_047.jpg
Raging Bull;Sport;The life of boxer Jake LaMotta, whose violence and temper that led him to the top in the ring destroyed his life outside of it.;Sport_048.jpg
Jerry Maguire;Sport;When a sports agent has a moral epiphany and is fired for expressing it, he decides to put his new philosophy to the test as an independent agent with the only athlete who stays with him and his former colleague.;Sport_049.jpg
The Mighty Ducks;Sport;A self-centered Minnesota lawyer is sentenced to community service coaching a rag tag youth hockey team.;Sport_050.jpg
Black Panther: Wakanda Forever;Thriller;The people of Wakanda fight to protect their home from intervening world powers as they mourn the death of King T'Challa.;Thriller_01.jpg
Andor;Thriller;Prequel series to Star Wars' 'Rogue One'. In an era filled with danger, deception and intrigue, Cassian will embark on the path that is destined to turn him into a Rebel hero.;Thriller_02.jpg
The Walking Dead;Thriller;Sheriff Deputy Rick Grimes wakes up from a coma to learn the world is in ruins and must lead a group of survivors to stay alive.;Thriller_03.jpg
The Peripheral;Thriller;Set in the future when technology has subtly altered society, a woman discovers a secret connection to an alternate reality as well as a dark future of her own.;Thriller_04.jpg
The Menu;Thriller;A young couple travels to a remote island to eat at an exclusive restaurant where the chef has prepared a lavish menu, with some shocking surprises.;Thriller_05.jpg
Don't Worry Darling;Thriller;A 1950s housewife living with her husband in a utopian experimental community begins to worry that his glamorous company could be hiding disturbing secrets.;Thriller_06.jpg
Guillermo del Toro's Cabinet of Curiosities;Thriller;Bizarre nightmares unfold in eight tales of terror in a visually stunning, spine-tingling horror collection curated by Guillermo del Toro.;Thriller_07.jpg
Where the Crawdads Sing;Thriller;A woman who raised herself in the marshes of the Deep South becomes a suspect in the murder of a man with whom she was once involved.;Thriller_08.jpg
Smile;Thriller;After witnessing a bizarre, traumatic incident involving a patient, Dr. Rose Cotter starts experiencing frightening occurrences that she can't explain. Rose must confront her troubling past in order to survive and escape her horrifying new reality.;Thriller_09.jpg
The Wonder;Thriller;A tale of two strangers who transform each other's lives, a psychological thriller, and a story of love pitted against evil.;Thriller_010.jpg
Manifest;Thriller;A commercial airliner suddenly reappears after being missing for five years. As those aboard reintegrate into society, they experience guiding voices and visions of events yet to occur, and soon a deeper mystery unfolds.;Thriller_011.jpg
Barbarian;Thriller;A woman staying at an Airbnb discovers that the house she has rented is not what it seems.;Thriller_012.jpg
The Handmaid's Tale;Thriller;Set in a dystopian future, a woman is forced to live as a concubine under a fundamentalist theocratic dictatorship.;Thriller_013.jpg
American Horror Story;Thriller;;Thriller_014.jpg
Amsterdam;Thriller;In the 1930s, three friends witness a murder, are framed for it, and uncover one of the most outrageous plots in American history.;Thriller_015.jpg
